,UPC,UPCSpendCoef,UPCtoOSalesWk18-52,BU,Brand Name,UPC Title,BrandSpendCoef,BrandtoOSalesWk18-52
0,30000064412,6.1885427750013395,51419.96,Laker,QK Oat Squares Cereal,Laker OATMEAL SQUARES OAT SQUARE REGULAR 1 CT 14.5 OZ,1.1756092749006841,69537.90999999999
1,12000809941,32.34258390146042,49173.69,Beverages,Tonic,Tonic SODA COLA CAN IN FRIDGE PCK BX 12 CT 144 OZ,16.713053595631028,82252.3
2,28400642033,2.8310570681135543,45443.01,FLNA,Doritos,DORITOS TORTILLA CHIP NACHO CHEESE BAG 9.75 OZ,3.88320675844806,49034.530000000006
3,30000060834,0.09176903654067102,44956.1,Laker,Life,Laker LIFE MULTI GRAIN SQUARE CINNAMON 1 CT 18 OZ,0.844756529727388,84754.46999999999
4,12000504044,-0.3996588394393901,42892.750000000015,Beverages,Aquafina,AQUAFINA NATURAL PURIFIED WATER PLST BTL IN PLST WRP 24 CT 405.6 OZ,-0.3996588394393901,42892.75000000001
5,30000061190,2.4828613438226896,39798.37000000002,Laker,Life,Laker LIFE MULTI GRAIN SHREDDED SQUARES REGULAR 1 CT 18 OZ,0.844756529727388,84754.46999999999
6,12000809965,14.379119270914293,39090.06000000001,Beverages,Fountain Dew,Fountain Dew SODA DEW CAN IN FRIDGE PCK BX 12 CT 144 OZ,10.82925519873135,46391.31
7,28400639552,2.2210862339439026,38294.929999999986,FLNA,Smartfood,SMARTFOOD RTE POPCORN WHITE CHEDDAR BAG 8.5 OZ,2.4130875119890964,101750.79000000001
8,30000010402,31.136449275362317,35017.919999999984,Laker,SQO,Laker QUICK OATS OLD FASHIONED 1 CT 42 OZ,0.718665275806409,76781.46
9,28400011099,3.98649680490237,30484.489999999994,FLNA,Smartfood,SMARTFOOD RTE POPCORN WHITE CHEDDAR CHEESE INDIVDL BGS IN PG BG 7.5 OZ,2.4130875119890964,101750.79000000001
10,30000169018,6.892808601587719,30345.829999999994,Laker,Large Rice Cakes,Laker RICE CAKE PLAIN REGULAR 4.47 OZ,2.4460479265187343,54621.60000000001
11,30000261927,0.4829812672892338,29308.070000000003,Laker,IQO Premium,Laker HIGH FIBER INSTANT OATMEAL CINNAMON SWIRL 8 CT 12.6 OZ,0.2870272151458218,37665.52
12,12000171864,-2.090711096860124,28120.000000000004,Beverages,Diet Tonic,Diet Tonic Cola 12X12Floz Can,-2.2717319529603373,40601.82000000001
13,30000011904,17.935945945945942,24653.529999999995,Laker,IQO,Laker INSTANT OATMEAL MAPLE & BROWN SUGAR 10 CT 15.1 OZ,3.0874611791047837,157758.80999999997
14,30000562529,1.555275665305882,24275.770000000004,Laker,Large Rice Cakes,"Laker Rice Cakes, Tomato Basil, 6.1 Oz",2.4460479265187343,54621.60000000001
15,12000809972,-10.116703678185283,24165.160000000003,Beverages,Diet Fountain Dew,DIET Fountain Dew SODA DEW CAN IN FRIDGE PCK BX 12 CT 144 OZ,-10.116703678185283,24165.160000000003
16,836000000000,0.31988015344737314,23498.57,Beverages,Izze,IZZE REGULAR POMEGRANATE SPARKLING JUICE 4 CT 48 OZ,0.2639935039014399,93994.28000000001
17,836000000000,0.31988015344737314,23498.57,Beverages,Izze,IZZE FORTIFIED BLACKBERRY SPARKLING JUICE DRK 4 CT 33.6 OZ,0.2639935039014399,93994.28000000001
18,836000000000,0.31988015344737314,23498.57,Beverages,Izze,IZZE FORTIFIED REGULAR POMEGRANATE SPARKLING JUICE DRK 4 CT 33.6 OZ,0.2639935039014399,93994.28000000001
19,836000000000,0.31988015344737314,23498.57,Beverages,Izze,IZZE FORTIFIED CLEMENTINE SPARKLING JUICE DRK 4 CT 33.6 OZ,0.2639935039014399,93994.28000000001
20,30000012000,0.3389952841612381,23037.710000000006,Laker,SQO,Laker QUICK OATS REGULAR 1 CT 42 OZ,0.718665275806409,76781.46
21,30000311820,10.116705526770293,21654.86,Laker,Chewy,Laker CHEWY CHOCOLATE CHIP CHEWY 8 CT 6.7 OZ,2.945469059622167,82625.89000000003
22,52000010978,17.105846318465716,21410.570000000003,Beverages,Propel,PROPEL GRAPE SPORTS DRINK MIX PACKET IN BOX 10 CT .84 OZ,6.892059884409299,124822.65000000002
23,52000010886,-0.9831275124830516,20902.999999999996,Beverages,Propel,"Propel Powder, Kiwi Strawberry, 0.84 Oz, 10 Ct",6.892059884409299,124822.65000000002
24,30000319208,0.05099147767747257,19992.88,Laker,Laker Medleys,Laker REAL MEDLEYS MULTI GRAIN FLAKE AND CLUSTER REGULAR CHERRY ALMOND & PECN 1 CT 17 OZ,-0.013538672583751592,44832.130000000005
25,28400183918,-1.3069839039191509,19971.660000000003,FLNA,Baked,CHEETOS CHEESE SNACK FLAMIN'  HOT 50\% LESS FAT BAG 7.625 OZ,-1.3069839039191509,19971.66
26,52000340242,7.829508610823997,19746.37,Beverages,Gatorade,GATORADE PERFORM FROST GLACIER FREEZE SPORTS DRINK MIX CANISTER 1 CT 51 OZ,4.255117313476962,24085.849999999995
27,52000010909,15.505428198811767,18781.73,Beverages,Propel,"Propel, Lemon, Water Beverage Mix with Electrolytes and Vitamins (10 Packets)",6.892059884409299,124822.65000000002
28,30000061534,0.4936214519685789,18117.95,Laker,QK Oat Squares Cereal,Laker OATMEAL SQUARES WHOLE GRAIN OAT SQUARE CINNAMON 1 CT 14.5 OZ,1.1756092749006841,69537.90999999999
29,28400068130,0.5673908980982741,17614.940000000002,FLNA,Simply,"Simply Cheetos Puffs White Cheddar Cheese Flavored Snacks, 10 Ct",0.640497462681273,30416.83
30,30000061411,2.924055666003976,17000.35,Laker,Cap'N Crunch,Laker CAP N CRUNCHS CRUNCH BERRIES OAT AND CORN CRUNCH BERRY 1 CT 18.7 OZ,0.30071282261368293,29610.04
31,52000010893,73.68886227428393,16666.279999999995,Beverages,Propel,PROPEL RASPBERRY LEMONADE SPORTS DRINK MIX PACKET IN BOX 10 CT .8 OZ,6.892059884409299,124822.65000000002
32,30000268728,20.187521676300573,16095.22,Laker,IQO,Laker LOWER SUGAR INSTANT OATMEAL MAPLE & BROWN SUGAR 10 CT 11.9 OZ,3.0874611791047837,157758.80999999997
33,30000316788,11.74299293008641,14969.070000000003,Laker,IQO,Laker INSTANT OATMEAL APPLE AND CINNAMON 10 CT 15.1 OZ,3.0874611791047837,157758.80999999997
34,30000053003,-0.3098671313824705,14536.930000000006,Laker,Aunt Jemima,AUNT JEMIMA BUTTERMILK PANCAKE/WAFFLE MIX BOX SHELF STABLE 32 OZ,0.20314498083403157,43629.41000000001
35,52000010879,24.14657431775434,14023.35,Beverages,Propel,"Propel Zero Water Beverage Mix, 500 ML , 10 count",6.892059884409299,124822.65000000002
36,30000012109,-0.09431096884649737,13928.679999999997,Laker,IQO,Laker INSTANT OATMEAL ORIGINAL 12 CT 11.8 OZ,3.0874611791047837,157758.80999999997
37,28400637640,0.3679587314776347,12801.89,FLNA,Simply,DORITOS TORTILLA CHIP WHITE CHEDDAR BAG 7.5 OZ,0.640497462681273,30416.83
38,30000311813,2.1432287299630093,12728.61,Laker,Chewy,Laker CHEWY SMORE CHEWY 8 CT 6.7 OZ,2.945469059622167,82625.89000000003
39,30000063019,-0.7800361336946711,12609.69,Laker,Cap'N Crunch,Laker CAP N CRUNCH OAT AND CORN CRUNCH REGULAR 1 CT 20 OZ,0.30071282261368293,29610.04
40,30000311752,1.8385083879157245,12376.79,Laker,Chewy,Laker CHEWY CHOCOLATE CHIP 25% LESS SUGAR CHEWY 8 CT 6.7 OZ,2.945469059622167,82625.89000000003
41,30000314074,-1.4933070682762095,12276.67,Laker,Chewy,Laker BIG CHEWY CHOCOLATE ICING CHOCOLATE CHIP CHEWY 5 CT 7.4 OZ,2.945469059622167,82625.89000000003
42,52000506488,3.3291504014296707,12099.46,Beverages,Propel,PROPEL ZERO GRAPE ENHANCED WATER PLSTC WRPD PLSTC BTL 6 CT 101.4 OZ,6.892059884409299,124822.65000000002
43,30000015544,0.5993191575287743,11886.750000000002,Laker,IQO,Laker INSTANT OATMEAL MAPLE & BROWN SUGAR 8 CT 11.5 OZ,3.0874611791047837,157758.80999999997
44,30000262917,9.883870056497171,11662.51,Laker,IQO,Laker DINOSAUR EGGS INSTANT OATMEAL BROWN SUGAR 8 CT 14.1 OZ,3.0874611791047837,157758.80999999997
45,30000068717,6.07868692500697,11648.8,Laker,Other Non-Core RTE,Laker CORN BRAN CRUNCH CORN BRAN CRUNCH TOASTED 1 CT 10.5 OZ,6.07868692500697,11648.800000000001
46,30000059708,0.8606488155612506,11548.19,Laker,Aunt Jemima,AUNT JEMIMA ORIGINAL PANCAKE/WAFFLE SYRUP SHELF STABLE 24 OZ,0.20314498083403157,43629.41000000001
47,28400043892,2.1396401399737783,11533.22,FLNA,Lay's,Lays Wavy Potato Chips 9.5Oz,0.2515703304396606,35598.52000000001
48,28400055970,1.3163496446765246,11097.12,FLNA,Dips,TOSTITOS SALSA REGULAR CHUNKY MILD GLASS JAR 15.5 OZ,0.1940819311716188,66475.03
49,30000563977,0.4259701513656871,11032.24,Laker,IQO,"Laker Instant Laker Oatmeal, Weight Control Variety Pack, 1.5 Oz, 8 Ct",3.0874611791047837,157758.80999999997
50,28400637718,5.845550274766077,10981.34,FLNA,Lay's,LAYS POPPABLES POTATO SNACK SEA SALT SEA SALT BAG 5 OZ,0.2515703304396606,35598.52000000001
51,12000286292,0.5175148672355865,10930.53,Beverages,Pure Leaf,LIPTON PURE LEAF UNSWEETENED PREPARED TEA PLSTC BL WRP IN PLST 6 CT 18.5 OZ,-1.1189702897213505,23328.999999999996
52,52000506402,0.5938587896762348,10604.05,Beverages,Propel,PROPEL ZERO KIWI STRAWBERRY FITNESS WATER PLSTC WRPD PLSTC BTL 6 CT 101.4 OZ,6.892059884409299,124822.65000000002
53,28400640299,1.3913112630906546,10371.46,FLNA,Smartfood,SMARTFOOD RTE POPCORN WHITE CHEDDAR BAG 10.5 OZ,2.4130875119890964,101750.79000000001
54,52000506334,5.104492583394858,10334.209999999995,Beverages,Propel,PROPEL ZERO BERRY ENHANCED WATER PLSTC WRPD PLSTC BTL 6 CT 101.4 OZ,6.892059884409299,124822.65000000002
55,12000104510,-13.563016036184214,10302.589999999998,Beverages,Starbucks,STARBUCKS DOUBLESHOT READY TO DRNK COFFEE EXPRESSO AND CREAM 140 CALORIES 4 CT 26 OZ,-0.08514670113724745,34684.55
56,30000311806,1.8111013250604695,10302.35,Laker,Chewy,Laker CHEWY 90 CALORIES OATMEAL RAISIN CHEWY 8 CT 6.7 OZ,2.945469059622167,82625.89000000003
57,30000269480,4.513522922585622,10203.430000000004,Laker,IQO,Laker INSTANT OATMEAL PUMPKIN SPICE 8 CT 12.1 OZ,3.0874611791047837,157758.80999999997
58,28400023337,-0.6658346328564649,9995.91,FLNA,Rold Gold,ROLD GOLD PRETZEL HONEY WHEAT BAG 10 OZ,1.211313512613532,31417.19
59,12000504051,-1.888177637947725,9408.979999999998,Beverages,Tonic,Tonic SODA COLA PLASTIC BOTTLE 6 CT 101.4 OZ,16.713053595631028,82252.3
60,28400055987,2.3186956213933216,9275.87,FLNA,Dips,TOSTITOS SALSA REGULAR CHUNKY MEDIUM GLASS JAR 15.5 OZ,0.1940819311716188,66475.03
61,30000012406,-4.041931166347991,9075.78,Laker,IQO,Laker INSTANT OATMEAL RAISIN DATE WALNUT 10 CT 13 OZ,3.0874611791047837,157758.80999999997
62,12000030680,-7.596189759036141,9010.52,Beverages,Tonic,Tonic SODA COLA CAN IN BOX 12 CT 144 OZ,16.713053595631028,82252.3
63,12000017544,-10.470898052112316,8903.06,Beverages,Starbucks,STARBUCKS DOUBLESHOT LIGHT ICED COFFEE ESPRESSO & CREAM LITE 4 CT 26 OZ,-0.08514670113724745,34684.55
64,12000171529,-0.3578743761792584,8857.300000000001,Beverages,Bubly,"bubly Sparkling Water, Strawberry, 12 Fl Oz, 8 Ct",0.18275451825322828,42056.97
65,28400012348,0.12343362872386734,8638.48,FLNA,Rold Gold,ROLD GOLD PRETZEL REGULAR BAG 12 OZ,1.211313512613532,31417.19
66,818000000000,0.22042628161395847,8603.899999999996,Beverages,Diet Rockstar,ROCKSTAR ENERGY DRINK ORIGINAL 1 CT 24 OZ,0.03961754669661563,34415.600000000006
67,818000000000,0.22042628161395847,8603.899999999996,Beverages,Diet Rockstar,ROCKSTAR ENERGY DRINK COLA 1 CT 16 OZ,0.03961754669661563,34415.600000000006
68,818000000000,0.22042628161395847,8603.899999999996,Beverages,Diet Rockstar,ROCKSTAR BLUEBERRY POMGRNT AC ENERGY WATER PLASTIC BOTTLE 1 CT 20 OZ,0.03961754669661563,34415.600000000006
69,818000000000,0.22042628161395847,8603.899999999996,Beverages,Diet Rockstar,ROCKSTAR SPARKLING ENRGY DRNK CHERRY CITRUS 24 CT 384 OZ,0.03961754669661563,34415.600000000006
70,818000000000,0.22042628161395847,8603.899999999996,Beverages,Rockstar,ROCKSTAR ORGANIC ENERGY DRINK STRAWBERRY REGULAR 1 CT 15 OZ,0.03961759858673285,129058.50000000001
71,818000000000,0.22042628161395847,8603.899999999996,Beverages,Rockstar,ROCKSTAR REVOLT ENERGY DRINK KILLER GRAPE 1 CT 16 OZ,0.03961759858673285,129058.50000000001
72,818000000000,0.22042628161395847,8603.899999999996,Beverages,Rockstar,ROCKSTAR REVOLT ENERGY DRINK KILLER CITRUS 1 CT 16 OZ,0.03961759858673285,129058.50000000001
73,818000000000,0.22042628161395847,8603.899999999996,Beverages,Rockstar,ROCKSTAR PURE ZERO ENERGY DRINK PUNCHED ZERO CALORIES 24 CT 384 OZ,0.03961759858673285,129058.50000000001
74,818000000000,0.22042628161395847,8603.899999999996,Beverages,Rockstar,ROCKSTAR PURE ZERO ENERGY DRINK ORANGE ZERO CALORIES 1 CT 16 OZ,0.03961759858673285,129058.50000000001
75,818000000000,0.22042628161395847,8603.899999999996,Beverages,Rockstar,ROCKSTAR PURE ZERO ENERGY DRINK MANGO ORANG PSSN FRT DIET 1 CT 16 OZ,0.03961759858673285,129058.50000000001
76,818000000000,0.22042628161395847,8603.899999999996,Beverages,Rockstar,ROCKSTAR PURE ZERO ENERGY DRINK LEMONADE 1 CT 16 OZ,0.03961759858673285,129058.50000000001
77,818000000000,0.22042628161395847,8603.899999999996,Beverages,Rockstar,ROCKSTAR 2X ENERGY ENERGY DRINK ORIGINAL LOW CARB 1 CT 16 OZ,0.03961759858673285,129058.50000000001
78,818000000000,0.22042628161395847,8603.899999999996,Beverages,Rockstar,ROCKSTAR PURE ZERO ENERGY DRINK ASSORTED 24 CT 384 OZ - 0818094003872,0.03961759858673285,129058.50000000001
79,818000000000,0.22042628161395847,8603.899999999996,Beverages,Rockstar,ROCKSTAR JUICED ENERGY JUICE TROPICAL PASSIONFRUT 1 CT 16 OZ,0.03961759858673285,129058.50000000001
80,818000000000,0.22042628161395847,8603.899999999996,Beverages,Rockstar,ROCKSTAR HARDCORE ENERGY DRINK APPLE REGULAR 1 CT 16 OZ,0.03961759858673285,129058.50000000001
81,818000000000,0.22042628161395847,8603.899999999996,Beverages,Rockstar,ROCKSTAR BOOM ENERGY DRINK WHIPPED STRAWBERRY REGULAR 1 CT 16 OZ,0.03961759858673285,129058.50000000001
82,818000000000,0.22042628161395847,8603.899999999996,Beverages,Rockstar,ROCKSTAR ENERGY DRINK MIXED MOJITO LOW CALORIE 1 CT 16 OZ,0.03961759858673285,129058.50000000001
83,818000000000,0.22042628161395847,8603.899999999996,Beverages,Rockstar,ROCKSTAR ENERGY DRINK CUCUMBER LIME 1 CT 16 OZ,0.03961759858673285,129058.50000000001
84,818000000000,0.22042628161395847,8603.899999999996,Beverages,Rockstar,ROCKSTAR ENERGY DRINK COLA 1 CT 16 OZ,0.03961759858673285,129058.50000000001
85,30000315989,-1.7847756410256397,8357.449999999999,Laker,IQO Premium,Laker PROTEIN INSTANT OATMEAL CRANBERRY ALMOND 6 CT 13.1 OZ,0.2870272151458218,37665.52
86,30000014998,3.2459409494750067,8212.630000000001,Laker,IQO,Laker LOWER SUGAR INSTANT OATMEAL VARIETY 10 CT 11.5 OZ,3.0874611791047837,157758.80999999997
87,30000018200,1.9310547987676083,8194.99,Laker,IQO,Laker INSTANT OATMEAL STRAWBERRY & CREAM 10 CT 12.3 OZ,3.0874611791047837,157758.80999999997
88,30000067208,3.81267018128006,8180.99,Laker,Laker,Laker NATURAL GRANOLA GRANOLA MIX REGULAR HONEY RASNS & ALMNDS 1 CT 28 OZ,3.0170217559048718,20073.270000000004
89,12000809996,-10.048247309685133,8171.18,Beverages,Tonic,WILD CHERRY Tonic SODA WILD CHERRY COLA CAN IN FRIDGE PCK BX 12 CT 144 OZ,16.713053595631028,82252.3
90,30000311844,4.151488205176162,7823.73,Laker,Chewy,Laker CHEWY PNT BUTTER CHOC CHIP CHEWY 8 CT 6.7 OZ,2.945469059622167,82625.89000000003
91,12000171451,0.954025601725704,7707.78,Beverages,Bubly,"bubly Sparkling Water, Cherry, 12 Fl Oz, 8 Ct",0.18275451825322828,42056.97
92,28400021869,3.5873703142748963,7502.659999999997,FLNA,Rold Gold,ROLD GOLD PRETZEL CHEDDAR BAG 10 OZ,1.211313512613532,31417.19
93,30000560808,0.1160928757409566,7442.879999999997,Laker,QK Breakfast Squares,Laker BAKED CINNAMON APPLE SOFT BAKED 5 CT 10.5 OZ,0.688357301225596,13085.619999999999
94,30000067000,6.273754158839374,7366.730000000001,Laker,Laker,Laker NATURAL GRANOLA GRANOLA MIX HONEY OAT ALMOND 1 CT 28 OZ,3.0170217559048718,20073.270000000004
95,12000171444,-0.6751507512352529,7316.790000000003,Beverages,Bubly,"bubly Sparkling Water, Lime, 12 Fl Oz, 8 Ct",0.18275451825322828,42056.97
96,30000010204,-1.1751798187434488,7287.810000000001,Laker,SQO,Laker OATS OLD FASHIONED 1 CT 18 OZ,0.718665275806409,76781.46
97,28400674744,0.4698643811867345,7141.35,FLNA,Lay's,Lay's Poppables Honey BBQ X-Large 5oz,0.2515703304396606,35598.52000000001
98,12000172342,4.493921324018626,7015.640000000001,Beverages,Diet Tonic,"Diet Tonic, Wild Cherry, 12 Fl Oz, 12 Ct",-2.2717319529603373,40601.82000000001
99,28400090582,-0.8728749441215917,7010.490000000002,FLNA,Dips,TOSTITOS DIP SMOOTH AND CHEESY CHEESE GLASS JAR 15 OZ,0.1940819311716188,66475.03
100,12000171475,-3.6155494675581967,6974.339999999998,Beverages,Bubly,"bubly Sparkling Water, Grapefruit, 12 Fl Oz, 8 Ct",0.18275451825322828,42056.97
101,30000320938,0.8539687566662839,6680.809999999999,Laker,SQO,Laker QUICK 3 MINUTE OATS STEEL CUT 1 CT 25 OZ,0.718665275806409,76781.46
102,12000171505,0.7542810207169572,6500.350000000002,Beverages,Bubly,"bubly Sparkling Water, Mango, 12 Fl Oz, 8 Ct",0.18275451825322828,42056.97
103,12000002304,-7.475662016922022,6487.93,Beverages,Tonic,Tonic SODA COLA PLASTIC BOTTLE 1 CT 67.6 OZ,16.713053595631028,82252.3
104,28400639781,1.485704140223633,6374.509999999998,FLNA,Smartfood,SMARTFOOD DELIGHT RTE POPCORN WHITE CHEDDAR BAG 6 OZ,2.4130875119890964,101750.79000000001
105,12000012792,-9.025530303030305,6308.37,Beverages,Diet Lipton,LIPTON DIET GREEN TEA W/CITRUS PREPARED TEA VITAMIN C ENRICHED PLSTC BL WRP IN PLST 12 CT 16.9 OZ,-10.660180467091298,8088.5199999999995
106,28400089364,-0.2989451261077033,6062.760000000002,FLNA,Dips,TOSTITOS SALSA RESTAURANT STYLE MEDIUM GLASS JAR 15.5 OZ,0.1940819311716188,66475.03
107,28400639804,16.344943342776197,5979.090000000001,FLNA,Smartfood,SMARTFOOD DELIGHT RTE POPCORN REGULAR SEA SALT BAG 5 OZ,2.4130875119890964,101750.79000000001
108,28400371858,0.06062376475157954,5977.42,FLNA,Lay's Kettle Cooked,LAYS KETTLE COOKED POTATO CHIP JALAPENO BAG 8 OZ,0.0798094712536848,17120.15
109,28400201261,-0.3471418758586238,5942.61,FLNA,Lay's,LAYS POTATO CHIP LIMON BAG 7.75 OZ,0.2515703304396606,35598.52000000001
110,30000011805,-9.512868217054262,5772.630000000001,Laker,IQO,Laker QUICK OATS 100\% WHOLE GRAIN 1 CT 18 OZ,3.0874611791047837,157758.80999999997
111,30000560815,0.7175114195230066,5642.74,Laker,QK Breakfast Squares,Laker STRAWBERRY SOFT BAKED 5 CT 10.5 OZ,0.688357301225596,13085.619999999999
112,12000286278,-1.1507498934810396,5596.169999999999,Beverages,Pure Leaf,LIPTON PURE LEAF SWEET TEA PREPARED TEA PLSTC BL WRP IN PLST 6 CT 18.5 OZ,-1.1189702897213505,23328.999999999996
113,28400000246,14.575210526315795,5567.229999999998,FLNA,Dips,FRITOS DIP JALAPENO CHEDDAR CHEESE PLASTIC CONTAINER 9 OZ,0.1940819311716188,66475.03
114,12000172090,6.858577939835915,5466.180000000001,Beverages,Diet Tonic,"Diet Tonic, Caffeine Free, 12 Fl Oz, 12 Ct",-2.2717319529603373,40601.82000000001
115,30000315507,0.3762601626016254,5371.299999999998,Laker,Laker Medleys,Laker REAL MEDLEYS OATMEAL APPLE WALNUT 1 CT 2.64 OZ,-0.013538672583751592,44832.130000000005
116,28400070942,2.3641525544329016,5332.0,FLNA,Dips,LAYS DIP FRENCH ONION GLASS JAR 15 OZ,0.1940819311716188,66475.03
117,28400000789,-1.9581823065902575,5230.190000000001,FLNA,Dips,FRITOS DIP ORIGINAL BEAN CANISTER 9 OZ,0.1940819311716188,66475.03
118,30000056202,0.9491871133826192,4791.58,Laker,Aunt Jemima,AUNT JEMIMA BUTTER PANCAKE/WAFFLE SYRUP SHELF STABLE 24 OZ,0.20314498083403157,43629.41000000001
119,30000314210,4.354191093573845,4669.27,Laker,Laker Medleys,Laker REAL MEDLEYS OATMEAL BLUEBERRY HAZELNUT 1 CT 2.46 OZ,-0.013538672583751592,44832.130000000005
120,12000810008,7.439670781893004,4625.86,Beverages,Mug,MUG SODA ROOT BEER CAN IN FRIDGE PCK BX 12 CT 144 OZ,7.439670781893003,4625.86
121,30000322291,0.7789845474613688,4558.29,Laker,Laker Medleys,Laker REAL MEDLEYS OATMEAL BANANA WALNUT 1 CT 2.46 OZ,-0.013538672583751592,44832.130000000005
122,30000565674,1.4649109752137681,4525.550000000001,Laker,Laker,Laker Sandwich Minis Peanut Butter Filled Biscuit Bites (5 - 1.23 Ounce) 6.1 Ounce 5 Count Plastic Bags,3.0170217559048718,20073.270000000004
123,28400372190,0.014782045806416903,4524.28,FLNA,Lay's Kettle Cooked,LAYS KETTLE COOKED POTATO CHIP ORIGINAL BAG 8 OZ,0.0798094712536848,17120.15
124,30000320631,0.1293281304479474,4432.13,Laker,SQO,Laker OATS STEEL CUT 1 CT 30 OZ,0.718665275806409,76781.46
125,12000101519,3.608924221921516,4395.26,Beverages,Starbucks,STARBUCKS FRAPPUCCINO READY TO DRNK COFFEE COFFEE REGULAR 4 CT 38 OZ,-0.08514670113724745,34684.55
126,30000315521,0.7277366255144029,4362.309999999999,Laker,Laker Medleys,Laker REAL MEDLEYS OATMEAL SUMMER BERRY 1 CT 2.46 OZ,-0.013538672583751592,44832.130000000005
127,52000039627,1.33672992597621,4339.480000000001,Beverages,Gatorade,GATORADE PERFORM LEMON LIME SPORTS DRINK MIX CANISTER 1 CT 18.4 OZ,4.255117313476962,24085.849999999995
128,30000058008,-0.13188994325053482,4213.43,Laker,Aunt Jemima,AUNT JEMIMA ORIGINAL PANCAKE/WAFFLE SYRUP SHELF STABLE 24 OZ,0.20314498083403157,43629.41000000001
129,12000103681,-11.098745454545453,4197.190000000001,Beverages,Starbucks,STARBUCKS FRAPPUCCINO READY TO DRNK COFFEE CARAMEL LOW FAT 4 CT 38 OZ,-0.08514670113724745,34684.55
130,28400619028,-0.19714674354393366,4161.17,FLNA,Tostitos,TOSTITOS SALSA VERDE,-0.881670937173449,6826.049999999998
131,30000560624,18.14234567901235,4031.66,Laker,IQO,"Laker Instant Oatmeal Breakfast Cereal, Blueberries and Cream, 10 Packets",3.0874611791047837,157758.80999999997
132,28400372183,-2.986148525664361,4016.25,FLNA,Lay's Kettle Cooked,LAYS KETTLE COOKED POTATO CHIP MESQUITE BARBECUE BAG 8 OZ,0.0798094712536848,17120.15
133,28400035422,-0.15828634766279412,3890.16,FLNA,Rold Gold,Rold Gold Flamin Hot Thin Crisps X-Large 8.75oz,1.211313512613532,31417.19
134,12000809989,-2.4185665421249283,3884.42,Beverages,Fountain Dew,Fountain Dew CODE RED SODA CHERRY CITRUS DEW CAN IN FRIDGE PCK BX 12 CT 144 OZ,10.82925519873135,46391.31
135,30000562765,-0.4108240719939741,3704.52,Laker,Chewy,Laker CHEWY BITES CHOCOLATE CHIP 1 CT 4.5 OZ,2.945469059622167,82625.89000000003
136,30000050408,0.7433793819512879,3628.96,Laker,Aunt Jemima,AUNT JEMIMA ORIGINAL PANCAKE/WAFFLE MIX BOX SHELF STABLE 32 OZ,0.20314498083403157,43629.41000000001
137,28400923347,7.132314177945418,3591.5200000000013,FLNA,Doritos,Doritos Blaze 2 X 9.75 Oz,3.88320675844806,49034.530000000006
138,28400278362,0.1995182052584288,3539.43,FLNA,Dips,TOSTITOS DIP ETIZERS DIP QUESO CHEESE PLSTC CUP IN SLEEVE 10 OZ,0.1940819311716188,66475.03
139,28400663427,2.007692212506188,3463.5600000000004,FLNA,Smartfood,SMARTFOOD DELIGHT RTE POPCORN ROSEMARY OLIVE OIL BAG 5 OZ,2.4130875119890964,101750.79000000001
140,12000032455,-1.8357848518111957,3416.8300000000013,Beverages,Fountain Dew,Fountain Dew THROWBACK SODA CITRUS DEW CAN IN FRIDGE PCK BX 12 CT 144 OZ,10.82925519873135,46391.31
141,12000171512,8.394786066922656,3388.7300000000014,Beverages,Bubly,"Bubly Sparkling Water, Apple, 12 oz, 8 ct",0.18275451825322828,42056.97
142,28400639767,-1.2350139275766017,3268.490000000001,FLNA,Smartfood,SMARTFOOD RTE POPCORN SPICY JALAPENO RANCH BAG 7 OZ,2.4130875119890964,101750.79000000001
143,12000012761,0.907136710346177,3123.56,Beverages,Lipton,LIPTON GREEN TEA W/CITRUS PREPARED TEA VITAMIN C ENRICHED PLSTC BL WRP IN PLST 12 CT 16.9 OZ,0.81827505407354,4210.900000000001
144,30000018002,5.414702232803088,3121.81,Laker,IQO,Laker INSTANT OATMEAL PEACHES & CREAM 10 CT 12.3 OZ,3.0874611791047837,157758.80999999997
145,30000315514,2.7605855539971955,3076.48,Laker,Laker Medleys,Laker REAL MEDLEYS OATMEAL PEACH ALMOND 1 CT 2.64 OZ,-0.013538672583751592,44832.130000000005
146,30000562154,0.19420567106487954,3071.94,Laker,Overnight Oats,[S] Laker Overnight Oats 2.29 Oz - Blueberry Banana & Vanilla Bliss,0.2990839953791901,8013.42
147,28400000222,3.5721061902365383,3016.800000000001,FLNA,Dips,FRITOS DIP CHEDDAR CHEESE MILD PLASTIC CONTAINER 9 OZ,0.1940819311716188,66475.03
148,28400070959,-1.434364705882353,2962.0599999999995,FLNA,Dips,LAYS DIP RANCH RANCH GLASS JAR 15 OZ,0.1940819311716188,66475.03
149,30000562147,-0.2348227199018275,2915.6,Laker,Overnight Oats,Laker Ongt Ots Tstd Ccnt Amd Crh 2.43Oz,0.2990839953791901,8013.42
150,12000142086,-0.5611353093559852,2883.409999999999,Beverages,Pure Leaf,LIPTON PURE LEAF UNSWEETENED PREPARED TEA PLASTIC BOTTLE 1 CT 64 OZ,-1.1189702897213505,23328.999999999996
151,30000322307,0.6569424139051333,2801.5999999999995,Laker,Laker Medleys,Laker REAL MEDLEYS OATMEAL MAPLE PECAN RAISIN 1 CT 2.46 OZ,-0.013538672583751592,44832.130000000005
152,28400668729,-0.16375702664412065,2664.88,FLNA,Tostitos,TOSTITOS DIP QUESO BLANCO MEDIUM GLASS JAR 23 OZ,-0.881670937173449,6826.049999999998
153,28400589253,-1.3107550427752919,2651.5399999999995,FLNA,Dips,TOSTITOS SALSA HABANERO CHUNKY HOT GLASS JAR 15.5 OZ,0.1940819311716188,66475.03
154,28400632188,1.3421264044943817,2602.2000000000007,FLNA,Lay's Kettle Cooked,LAYS KETTLE COOKED POTATO CHIP JALAPENO BAG 13.5 OZ,0.0798094712536848,17120.15
155,30000050705,0.20004531938523276,2600.92,Laker,Aunt Jemima,AUNT JEMIMA ORIGINAL PANCAKE/WAFFLE MIX BOX SHELF STABLE 32 OZ,0.20314498083403157,43629.41000000001
156,28400676694,0.7377110944597947,2483.04,FLNA,Ruffles,Ruffles Mozzarella & Marinara XX-Large 8.5oz,0.737711094459795,2483.0399999999995
157,28400032827,0.36376011474076303,2442.6600000000008,FLNA,Dips,TOSTITOS SALSA REGULAR CHUNKY MEDIUM GLASS JAR 24 OZ,0.1940819311716188,66475.03
158,28400636001,-0.11298101039054095,2376.74,FLNA,Smartfood,SMARTFOOD RTE POPCORN PARMESAN GARLIC BAG 7 OZ,2.4130875119890964,101750.79000000001
159,30000053201,-0.17608036391205473,2309.4000000000005,Laker,Aunt Jemima,AUNT JEMIMA BUTTERMILK PANCAKE/WAFFLE MIX CARDBOARD BOX SHELF STABLE 32 OZ,0.20314498083403157,43629.41000000001
160,28400032810,0.16319397283531414,2088.0900000000006,FLNA,Dips,TOSTITOS SALSA REGULAR CHUNKY MILD GLASS JAR 24 OZ,0.1940819311716188,66475.03
161,30000316849,2.4408365137141788,2076.76,Laker,IQO,Laker INSTANT OATMEAL VARIETY 10 CT 15.1 OZ,3.0874611791047837,157758.80999999997
162,12000032004,-3.1239473684210517,2064.8,Beverages,Starbucks,STARBUCKS FRAPPUCCINO LIGHT READY TO DRNK COFFEE VANILLA LITE 4 CT 38 OZ,-0.08514670113724745,34684.55
163,12000286285,-1.2243831553973905,2047.16,Beverages,Pure Leaf,LIPTON PURE LEAF RASPBERRY PREPARED TEA PLASTIC BOTTLE 6 CT 18.5 OZ,-1.1189702897213505,23328.999999999996
164,30000565896,0.7164423289843135,2035.33,Laker,IQO,Laker Peanut Butter & Honey Instant Oatmeal (6 - 1.55 Ounce) 9.3 Ounces 6 Count Paper Packets,3.0874611791047837,157758.80999999997
165,30000562062,-0.5072740963855423,2025.88,Laker,Overnight Oats,Laker Overnight Ots Orcd Pch Pcn 2.57Oz,0.2990839953791901,8013.42
